{
  "$schema": "https://json-schema.org/draft/2020-12/schema",
  "$id": "hypotheses.schema.json",
  "title": "hypotheses",
  "type": "object",
  "properties": {
    "id": {
      "type": "string",
      "pattern": "^H\\d{2}$"
    },
    "subject": {
      "anyOf": [
        {
          "type": "string",
          "pattern": "^[A-Z][A-Z0-9_]*$"
        },
        {
          "type": "string",
          "pattern": "^(TL-\\d{4}|EXT-\\d{3})$"
        }
      ]
    },
    "object": {
      "anyOf": [
        {
          "type": "string",
          "pattern": "^[A-Z][A-Z0-9_]*$"
        },
        {
          "type": "string",
          "pattern": "^(TL-\\d{4}|EXT-\\d{3})$"
        }
      ]
    },
    "hypothesis_type": {
      "type": "string",
      "pattern": "^[A-Z][A-Z0-9_]*$"
    },
    "question": {
      "type": "object",
      "properties": {
        "it": {
          "type": "string",
          "minLength": 1
        },
        "en": {
          "type": "string",
          "minLength": 1
        }
      },
      "required": [
        "it"
      ],
      "additionalProperties": false
    },
    "current_limit": {
      "type": "object",
      "properties": {
        "it": {
          "type": "string",
          "minLength": 1
        },
        "en": {
          "type": "string",
          "minLength": 1
        }
      },
      "required": [
        "it"
      ],
      "additionalProperties": false
    },
    "priority": {
      "type": "string",
      "enum": [
        "critical",
        "high",
        "medium",
        "low"
      ]
    },
    "evidence_needed": {
      "type": "object",
      "properties": {
        "it": {
          "type": "string",
          "minLength": 1
        },
        "en": {
          "type": "string",
          "minLength": 1
        }
      },
      "required": [
        "it"
      ],
      "additionalProperties": false
    },
    "events": {
      "type": "array",
      "items": {
        "type": "string",
        "pattern": "^(TL-\\d{4}|EXT-\\d{3})$"
      }
    },
    "external_url": {
      "anyOf": [
        {
          "type": "string",
          "format": "uri"
        },
        {
          "type": "null"
        }
      ]
    },
    "status": {
      "type": "string",
      "enum": [
        "open_unproven",
        "under_review",
        "promoted",
        "refuted",
        "closed_insufficient"
      ]
    },
    "sources": {
      "type": "array",
      "items": {
        "type": "string",
        "pattern": "^(S\\d{2}|F\\d{2}|P\\d{2}|WEB|WEB-EXT-\\d{3})$"
      }
    },
    "review": {
      "type": "object",
      "properties": {
        "status": {
          "type": "string",
          "enum": [
            "imported_unreviewed",
            "needs_review",
            "reviewed"
          ]
        },
        "notes": {
          "type": "array",
          "items": {
            "type": "string",
            "minLength": 1
          }
        },
        "translations": {
          "type": "object",
          "properties": {
            "en": {
              "type": "object",
              "properties": {
                "status": {
                  "type": "string",
                  "enum": [
                    "machine",
                    "reviewed"
                  ]
                },
                "source_hash": {
                  "type": "string",
                  "pattern": "^[0-9a-f]{16}$"
                }
              },
              "required": [
                "status",
                "source_hash"
              ],
              "additionalProperties": false
            }
          },
          "additionalProperties": false
        }
      },
      "required": [
        "status",
        "notes"
      ],
      "additionalProperties": false
    },
    "provenance": {
      "type": "array",
      "items": {
        "anyOf": [
          {
            "type": "object",
            "properties": {
              "file": {
                "type": "string",
                "format": "starts_with",
                "pattern": "^sources\\/.*"
              },
              "row": {
                "type": "integer",
                "exclusiveMinimum": 0,
                "maximum": 9007199254740991
              },
              "original": {
                "type": "object",
                "propertyNames": {
                  "type": "string"
                },
                "additionalProperties": {
                  "type": "string"
                }
              }
            },
            "required": [
              "file",
              "row",
              "original"
            ],
            "additionalProperties": false
          },
          {
            "type": "object",
            "properties": {
              "file": {
                "type": "string",
                "format": "starts_with",
                "pattern": "^sources\\/.*"
              },
              "line": {
                "type": "integer",
                "exclusiveMinimum": 0,
                "maximum": 9007199254740991
              },
              "original": {
                "type": "object",
                "properties": {
                  "text": {
                    "type": "string"
                  }
                },
                "required": [
                  "text"
                ],
                "additionalProperties": false
              }
            },
            "required": [
              "file",
              "line",
              "original"
            ],
            "additionalProperties": false
          }
        ]
      }
    }
  },
  "required": [
    "id",
    "subject",
    "object",
    "hypothesis_type",
    "question",
    "current_limit",
    "priority",
    "evidence_needed",
    "events",
    "external_url",
    "status",
    "sources",
    "review",
    "provenance"
  ],
  "additionalProperties": false
}
