{
  "id": "H03",
  "subject": "RU_PRESS",
  "object": "PAPER",
  "hypothesis_type": "SCAMBIO_NARRATIVE_CINA_RUSSIA",
  "question": {
    "it": "Il riuso Paperwall di fonti russe deriva da accordi editoriali, aggregazione automatica o istruzioni statali?",
    "en": "Does Paperwall's reuse of Russian sources stem from editorial agreements, automated aggregation or state instructions?"
  },
  "current_limit": {
    "it": "Ripresa di contenuti dimostrata; coordinamento non dimostrato.",
    "en": "Content reuse demonstrated; coordination not demonstrated."
  },
  "priority": "high",
  "evidence_needed": {
    "it": "Timestamp post originali, RSS/API, domini, hosting, partnership contrattuali, diffusione cross-platform",
    "en": "Original post timestamps, RSS/API, domains, hosting, contractual partnerships, cross-platform spread"
  },
  "events": [
    "TL-0082"
  ],
  "external_url": null,
  "status": "open_unproven",
  "sources": [
    "S02",
    "S05"
  ],
  "review": {
    "status": "imported_unreviewed",
    "notes": [],
    "translations": {
      "en": {
        "status": "machine",
        "source_hash": "8c44c7989dc87e86"
      }
    }
  },
  "provenance": [
    {
      "file": "sources/original/Fonte_07_Ragnatela_Attori_Interessi_Relazioni_Europa_2026-10-21_ipotesi.csv",
      "row": 3,
      "original": {
        "id": "H03",
        "subject": "RU_PRESS",
        "object": "PAPER",
        "hypothesis_type": "SCAMBIO_NARRATIVE_CINA_RUSSIA",
        "verification_question": "Il riuso Paperwall di fonti russe deriva da accordi editoriali, aggregazione automatica o istruzioni statali?",
        "current_limit": "Ripresa di contenuti dimostrata; coordinamento non dimostrato.",
        "priority": "Alta",
        "evidence_needed": "Timestamp post originali, RSS/API, domini, hosting, partnership contrattuali, diffusione cross-platform",
        "source_docs": "S02,S05",
        "timeline_ids": "TL-0082",
        "external_url": "",
        "status": "open_unproven"
      }
    }
  ]
}
