{
  "id": "H01",
  "subject": "MED",
  "object": "VOL",
  "hypothesis_type": "CATENA_FINANZIARIA_COMUNE_SCHEMA_GILL_E_VOE",
  "question": {
    "it": "Si può dimostrare se Voice of Europe e tangenti Gill condivisero conti, veicoli o intermediari oltre Medvedchuk?",
    "en": "Can it be shown whether Voice of Europe and the Gill bribes shared accounts, vehicles or intermediaries beyond Medvedchuk?"
  },
  "current_limit": {
    "it": "Non provato un unico circuito finanziario; sponsor politico è nodo condiviso ma schema e date diverse.",
    "en": "A single financial circuit is not proven; the political sponsor is a shared node, but the schemes and dates differ."
  },
  "priority": "high",
  "evidence_needed": {
    "it": "Contratti, atti penali UK, contabilità VOE, nominativi intermediari, bonifici e KYC",
    "en": "Contracts, UK criminal records, VOE accounts, names of intermediaries, transfers and KYC"
  },
  "events": [
    "TL-0015",
    "TL-0056",
    "TL-0060",
    "TL-0092"
  ],
  "external_url": "https://www.cps.gov.uk/cps/news/former-ukip-mep-jailed-taking-bribes",
  "status": "open_unproven",
  "sources": [
    "S01",
    "S06"
  ],
  "review": {
    "status": "imported_unreviewed",
    "notes": [],
    "translations": {
      "en": {
        "status": "machine",
        "source_hash": "214224191115d4b7"
      }
    }
  },
  "provenance": [
    {
      "file": "sources/original/Fonte_07_Ragnatela_Attori_Interessi_Relazioni_Europa_2026-10-21_ipotesi.csv",
      "row": 1,
      "original": {
        "id": "H01",
        "subject": "MED",
        "object": "VOL",
        "hypothesis_type": "CATENA_FINANZIARIA_COMUNE_SCHEMA_GILL_E_VOE",
        "verification_question": "Si può dimostrare se Voice of Europe e tangenti Gill condivisero conti, veicoli o intermediari oltre Medvedchuk?",
        "current_limit": "Non provato un unico circuito finanziario; sponsor politico è nodo condiviso ma schema e date diverse.",
        "priority": "Alta",
        "evidence_needed": "Contratti, atti penali UK, contabilità VOE, nominativi intermediari, bonifici e KYC",
        "source_docs": "S01,S06",
        "timeline_ids": "TL-0015;TL-0056;TL-0060;TL-0092",
        "external_url": "https://www.cps.gov.uk/cps/news/former-ukip-mep-jailed-taking-bribes",
        "status": "open_unproven"
      }
    }
  ]
}
